pid|tid|treated|succeeded|duration|searches|expands|examples|copies|pages|links|answers|content|q1|q2|q3|q4
57414|find|false|true|191672|2|0|0|0|1|0|2|0.05|4|For this particular task I searched for "find item in array by value" (which was pre-filled for whatever reason), and it just gave me a Google result. So basically the experience for this one was like searching in another tab, except more cramped in a small panel.|Instead of presenting the results as plain Google search results vs. fancy parsing and pulling out code signatures, could you pull out text that "looks like" code? Kind of like a mode in between the two modes. That would help me scan the results. But it was pretty quick regardless.|I just used the tool.
57414|currency|false|true|222796|2|0|0|0|1|0|2|0.04|4|Again, cramped version of a regular Google search, not seeing the point of the tool.|No, it was the first result, found it fast.|I did not.
57414|recent|false|false|425408|2|0|0|0|1|0|2|0.44|1|I couldn't find anything that would accept a unit string ("days", "months" etc) to do this properly. I was torn between using Google in another tab, and hacking something together to pass the tests, I went for choice #2 since time was running out. In a real world task, I would spend more time searching for the right way to do it.|Well, I didn't see the answer I needed, so that would be the information I would've liked to see.|not this time
57414|clone|true|true|163611|2|0|0|0|1|0|2|0.62|4|I didn't find a clear result on how to do a shallow copy, seems most people were asking about deep copies, but there were some mentions of using slice() so I went with that and it worked. Again, not really feeling that different from a Google search.|see previous answers|did not
57414|serve|true|true|399935|2|2|1|0|1|0|5|0.54|2|I wasn't able to find a solution using the tool, because I didn't know enough about the web server to figure out what I was looking at and how to reduce it to your desired solution.|None of the results seemed to be basic enough. For this one I only needed reference materials for the server code.|I searched in Google, and the first hit from expressjs.com had the answer. I guess this is too basic of a question for stackexchange .
59191|sort|false|true|272247|1|0|0|0|1|0|2|0.05|4|I believe that this is a simple and common enough problem that it was easy to find multiple solutions that would work. I liked how Scout was smart enough to jump to the best search result in the previews which ended up providing a working solution.|I don't believe that any additional information would have made the search result previews more helpful in this case.|I did not search outside the IDE for this task.
59191|currency|false|true|325342|1|0|0|0|2|0|8|0.13|3|I had to go through a few results before I found one that matched the problem.|Having a tooltip show and expand with the full text being hovered over within the search result preview would be useful for smaller displays.  Ordering the search results based on date to get the most recent answer and making the date bold or otherwise more prominent would be helpful.|I did not search outside the IDE.
59191|clone|true|false|371066|1|0|0|0|3|0|24|0.70|3|Most of the results provided were for performing a deep copy however the task stated that a shallow copy was acceptable.|Seeing the number of votes for the accepted answer in the search result previews might have made finding an answer easier as that might be an indicator of how much visibility the question had.|I did not search outside the IDE.
59191|find|true|true|264846|1|0|0|0|1|0|2|0.05|4|A good solution was easy to find, however the best answer was a little confusing as it had additional syntax that was unnecessary.|I don't feel that there was any additional information that would have made the result previews more helpful in this instance.|I did not search outside of the IDE for this task.
59191|recent|true|false|429370|1|1|1|0|2|0|12|0.41|4|I believe that given more time I would have found the solution with the provided search results. I believe that I should have made more use of the USAGE and CODE sections in the search result previews rather than opening the search result directly.|I don't believe any additional information was necessary in the search result previews.|I did not search outside the IDE for the task.
59191|serve|false|false|432631|1|0|0|0|3|0|6|0.35|4|It may have been due to my search query or unfamiliarity with the problem but I believe that I would have been able to find a solution with the help of Scout if given more time.|I don't think having anything else in the search result previews would have been much more helpful.|I did not search outside the IDE.
61514|currency|true|true|315925|1|1|1|0|1|0|2|0.10|5|I was able to find the solution instantly, however me being a neat freak it took longer just finding a way I wanted to present the code. Scout did a great job presenting the information in a manner that allowed me to work efficiently on this problem. I was able to find multiple solutions to this problem that I found helpful.|Everything was fine.|
61514|find|true|true|130954|1|0|0|0|1|0|2|0.08|5|I was able to find what was needed almost instantly, and Perform the task better than the other tasks, because I believe that the search result previews allowed me to find exactly what I needed. It is nice seeing different solutions right in the results page, and being able to look there instead of clicking into every link.|I think this was fine.|
61514|clone|false|true|238721|1|0|0|0|1|0|3|0.14|4|I went a different direction of this originally that made it more difficult than it had to be, Scout made finding the information needed much easier.|Maybe having some solutions show in the result section like in the Tutorial, I would like to see multiple in the results page so I don't have to click and find things.|
61514|serve|false|false|448638|3|0|0|0|8|0|18|0.46|5|After some time browsing scout, I found the above solution and was on my way to having a similar solution. Had I had an extra minute or two I would have come to this. Scout definitely helped me come to something I have not dealt with before in JS.|No|
62905|sort|true|false|368785|1|4|3|1|0|0|0|null|3|I made some typos in the code (i.e. 'traeds' instead of 'trades') and also didn't replace the name of the array in the sample code snippet quickly. This used up most of my time. Finding a relevant code sample seemed straightforward enough using Scout. However, due to time wasted on the above I could not tell for sure if the sample I used would have worked. The sample solution you have provided was the next option which is what I would have tried if I had more time.|It might have been more useful if the simpler code snippets were at the top of the search results.|I did not search outside of the IDE.
62905|currency|false|true|193807|1|0|0|0|1|0|2|0.03|5|I was able to find the relevant code snippet easily using the Scout tool. It saved me time compared to not using the tool.|The search results seemed optimum for this particular task|I did not search outside of the IDE.
62905|find|false|true|157286|3|0|0|0|3|0|2|0.08|5|I was easily able to put in a search term and get a relevant answer with a code sample using the scout tool. ||
62905|clone|true|true|155642|2|2|1|3|0|0|0|null|4|The selection of results using Scout were useful in getting a code snippet. The first one I tried (using JSON.stringify....) did not work. The second (using the map function and Object.Assign) did.  The slice option was quite a bit further done the search results.|Again, it might have been more useful to list the results on the basis of the simplest code snippet.|I did not search outside the IDE.
62905|serve|true|false|426601|2|5|5|2|0|0|0|null|3|I liked the fact that there were a number of relevant search items returned. However, it seemed difficult to determine exactly what part of the code snippet I needed to use. I think I got close with my attempt, however I would have needed more time.|The search results were good, but I needed more time.|I did not search outside of the IDE
62905|recent|false|true|177185|2|0|0|0|1|0|2|0.27|4|I got relevant search results using Scout. The first one returned gave me the code snippet I needed so the experience was good.|In this case, it worked well for me.|I did not search outside of the IDE.
65727|currency|true|true|211449|1|0|0|0|1|0|2|0.05|5|Scout is helping me so much. The results are easy to use.|No|I did not search outside the IDE.
65727|find|true|true|85763|1|0|0|0|1|0|2|0.06|5|The first search result in Scout was very useful.|No.|I did not search outside the IDE.
65727|recent|true|true|244031|2|0|0|0|2|0|5|0.28|5|This task was harder than the previous. Still Scout was very helpful!|No|I did not search outside the IDE.
65727|serve|false|false|428474|1|0|0|0|2|0|6|0.49|1|I wasn't so sure what search terms to use to find an answer using Scout.|It would have been helpful to rank the searches based on number of StackOverflow likes.|I did not search outside the IDE.
69302|currency|true|false|358978|1|4|1|0|2|0|2|0.17|4|I liked that it generated a search string automatically and that it gives me several options. I didn't like that the result that I needed was third in line, I would have expected more relevant results to come up earlier. I found the interaction a bit clunky, the interface is a bit too busy|no|NA
69302|find|false|true|143556|1|0|0|0|1|0|2|0.37|4|I would have liked to see the embedded search results rather than going directly to google search but it worked|nothing|NA
69302|clone|false|true|446526|1|0|0|0|1|0|2|0.08|2|the signature wasn't available, it had to go through the normal Google searches. There was a network delay so it took longer than expected to load|having the code view instead of just the google search would have been helpful|NA
69302|recent|false|true|313300|2|0|0|0|1|0|2|0.21|4|I would have liked not having to come up with my own search terms and getting the signature page rather than the google search. It felt like a more cramped version of just googling stuff myself so not super different from using my browser|no really, once I got to the solution it was straightforward enough|no
69302|serve|true|true|405200|3|7|2|0|3|0|7|0.83|2|adding path to my search terms wasn't useful, I found it fairly confusing and had to poke at the code by trial and error. However I am not familiar with using express |a more structured suggested query|NA
69321|sort|true|true|127963|1|1|0|0|0|0|0|null|5|This task was perfect use case for this tool. first suggestion helped me finish the task easily.||
69321|currency|true|true|148084|1|1|1|0|0|0|0|null|5|the ranking of the suggestions could be improved. for example, the solution i was searching for was not the first result in the search.|default to code tab instead of usage in search results.|I did not
69321|find|false|true|83508|1|0|0|0|2|0|6|0.07|2|The screen space is so small that it does not save time than searching outside ide.||window is small to keep scrolling for the solution.
69321|clone|false|true|98825|2|0|0|0|2|0|3|0.45|2|without code preview, I prefer using the browser with more screen space to quickly search for usage results.||the search window in ide is so small that I switched to searching same in another tab.
69321|recent|false|true|286482|1|0|0|0|0|0|0|null|3|The window is small and i cannot read the whole question on stackoverflow. resulting in many unnecessary clicks wasting time.|usage and preview code.|small window size making it hard to eliminate links by reading questions.
69321|serve|true|true|172801|2|2|0|0|0|0|0|null|5|liked the usage and code preview.|some way to view the whole question or adding a horizontal scroll to view the whole question without clicking the link.|I did not
73430|sort|false|true|171916|1|0|0|0|2|0|2|0.06|5|||
73430|currency|true|true|175764|1|3|0|1|0|0|0|null|4|||
73430|serve|false|false|426508|2|0|0|0|6|0|13|0.39|1|||
73430|recent|true|false|432831|1|1|0|1|0|0|0|null||||
76613|sort|false|true|316981|2|0|0|0|5|0|4|null|4|I couldn't use the actual signature feature because of an error ("For security reasons, framing is not allowed."), but even the preview (the first three lines shown for the search result) was helpful enough||
76613|currency|true|true|183859|1|1|0|1|0|0|0|null|4|It wasn't too hard to find, although the sorting wasn't ideal (the top results were related to other kinds of number formatting)|Translating the example from the search result to the given task could have been easier if the result would e.g. match the parameters from the task.|
76613|find|true|true|95085|1|2|0|0|0|0|0|null|5|It was really easy to find the answer, even though it wasn't the first one in the list because they were nicely collapsed. The example also helped||
76613|clone|false|true|175651|2|0|0|0|4|0|1|null|5|It was very easy to immediately find the answer in the first line of the preview.||
81897|sort|true|true|85263|1|1|1|1|0|0|0|null|5|I liked that the first item in the list had the answer I needed, and also that the code snippets are now showing properly.  It would be nice if in answers where there are multiple code snippets, the one that is shortest is chosen to be shown first since that is usually the simpler method. |No.|
81897|find|false|true|103684|2|0|0|0|2|0|2|0.08|4|The code snippets didn't show up this time and it only showed me the stack overflow search results which was less intuitive.|Code snippets as part of the preview.|
81897|currency|false|true|124791|2|0|0|0|2|0|2|0.06|5|I liked that the first result of the search had the answer that I needed. |The code snippets being visible from outside would have helped, I don't know why that is no longer working.|
81897|clone|true|true|29246|1|2|1|0|0|0|0|null|5|I like that the first solution had the answer I needed, but it showed multiple different function signatures, and only one of them was relevant for the code that I was trying to implement. It showed json.parse, json.stringify, and .slice() but for this problem .slice() was the only relevant one. |No.|
81897|recent|false|true|147074|2|0|0|0|2|0|4|0.26|4|Although the answer was quickly findable in the first question, the code snippets once again did not show up, and I can't figure out how to add javascript manually to that search.|Code snippets.| 
81897|serve|true|true|144098|1|3|0|2|2|0|4|0.47|3|The first question was not what I was looking for, and there were no code snippets so I skipped over it. The second question had a few code snippets, but only one of them was relevant to serving static files on a specific route, and it took some trial and error before I could figure it out.|Highlight/direct to the answer that is most relevant to my case.|
87190|sort|true|true|275172|1|1|1|0|0|0|0|null|5|it's hard to copy and paste from scout|No|I didn't.
87190|currency|true|false|365064|1|2|0|0|1|0|1|0.02|4|I should have searched sooner, but I wanted to see what I could do on y own.|No, not really|I did not.
87190|clone|false|true|76157|1|0|0|0|1|0|2|0.03|4|It was a bit weird having it go to google results, but probably easier for me to understand|No|
87190|find|false|true|87737|1|0|0|0|1|0|2|0.06|5|Nothing beyond what I've already said|No|
87190|recent|false|true|150197|1|0|0|0|2|0|5|0.27|4|It's just google in the sidebar. It would be easier for me to use actual google because then i could copy/paste||
87190|serve|true|false|424812|1|1|1|0|0|0|0|null|3|I could not type in the IDE on this task.|Honestly I didn't understand any of it really because I couldn't actually try things.|
91073|sort|true|true|343337|1|3|1|1|0|0|0|null|2|I found code that sorts ascending and other unknown code using sortBy||
91073|currency|false|true|144284|1|0|0|0|1|0|2|0.05|4|It didn't show me the signatures. It said cannot find signatures using google results.||
91073|clone|true|true|50497|1|4|1|1|0|0|0|null|4|The Usage tab shows only one step like JSON.parse which is hard to copy. ||
91073|find|false|true|105678|2|0|0|0|2|0|2|0.05|4|It's nice to have stack overflow browser in IDE but for such a easy task I don't think it's more efficient to use it.||
91073|recent|false|true|183946|2|0|0|0|2|0|4|0.07|5|It didn't show me any search suggestions but overall it was pretty easy to find the solution.||
91073|serve|true|true|332391|2|3|2|3|1|0|1|0.11|3|||
92307|sort|true|true|222067|1|5|5|3|0|0|0|null|3|Seems to include some useless results amongst the helpful ones||
92307|currency|true|true|362816|1|4|4|3|0|0|0|null|2|The extension seems to work well, but the help needed was quite far down.|Less clutter|
92307|find|false|true|85311|1|0|0|0|1|0|2|0.06|5|Didn't see the comment about undefined or [] until I clicked submit sorry||
92307|clone|false|true|43244|1|0|0|0|1|0|2|0.09|5|Very helpful that time!||
92307|recent|false|true|298918|2|0|0|0|1|0|2|0.17|4|Once I understood the task, then it was quick and easier to find my answer.||
92307|serve|true|true|147415|1|3|1|2|1|0|1|0.43|5|Again another easy one, extension works fantastic and really helped||
92652|currency|false|true|null|1|0|0|0|3|0|24|0.13|null|null|null|null
92652|find|true|true|null|1|1|1|1|0|0|0|null|null|null|null|null
92652|recent|true|true|327241|1|0|0|0|1|0|3|1.00|5|within the first search, i managed to find exactly what i was looking for and through practice it was easy to find what i was looking for |nope very easy to find a solution!|
92652|serve|false|false|null|0|0|0|0|0|0|0|null|2|with minimal experience with express it was hard to understand the solution from the articles. i wish there had been small summaries to explain the basics but looking at the solution it looks like i wasnt too far off |maybe include documentation from express to make it a little easier to understand the framework being used|
93100|sort|true|true|450135|1|2|0|0|1|0|2|0.02|4|||
93100|clone|false|true|31717|1|0|0|0|1|0|1|0.02||||
93100|currency|true|true|80720|1|2|0|1|0|0|0|null|4|horizontal scroll bar to see long line solutions is not really ideal|no|
93100|recent|false|true|134322|2|0|0|0|2|0|4|0.42||||
96947|currency|false|true|190256|2|0|0|0|1|0|2|0.33|4|||
96947|recent|true|true|303379|1|5|1|0|0|0|0|null|2|I dislike how the red "submit" button has a fixed position in this pane, I didn't realize that this was scrollable and there were more questions below.|If the first result showed that subtract() can accept more than one parameter, like the second result does.|
96947|serve|false|false|427701|2|0|0|0|3|0|18|0.81|2|||
99741|sort|true|true|184308|1|1|3|0|1|1|2|0.06|5|Again, the "most upvoted" icon was very helpful to decide which answer to click first. |In this case, comments in the code would have been useful to determine how to sort descending vs. ascending. It was easy though to view the full answer with comments.|
99741|currency|true|true|222767|1|4|0|0|0|0|0|null|5|I like the icons displaying which was the correct or most-upvoted answer. The icons helped decide where to click first. I am curious how the answers are ranked - is that Google? I may have missed that information in the introduction to the tool.||
99741|clone|false|true|123087|2|0|0|0|8|0|5|0.28|5|Scout was missing the organized function call signatures like the previous tasks. I liked those! My results looked like Google. ||
99741|find|false|true|125379|1|0|0|0|1|0|2|0.04|5|From the titles shown by the google search, I am able to quickly determine which link to click. |I couldn't see the function signatures from Scout, so had a list of Google search results. I was able to click the links to be directed to the original Stack Overflow site. |
99741|recent|false|true|417754|2|0|0|0|2|0|5|0.18|5|Again, the search results didn't have the method signatures/function summaries. Instead the results looked like Google. Still helpful to have that information in the IDE. ||
99741|serve|true|true|298901|1|7|5|0|2|2|8|0.60|4|In this case, I needed information about the question being asked, not just the answer's code. There were two functions, static() and use(), and I was unsure how they were used. I opened the full answer to see what question they were answering. ||
99907|find|true|true|113471|1|2|3|1|0|0|0|null|5|Good that it extracts the code out, that's very handy. Confused on what the Usage vs Code does...||
99907|sort|false|true|178069|2|0|0|0|2|0|1|0.06|4|For this task it was just stackoverflow in a window in the IDE.|No it was good|
99907|currency|true|true|132730|1|1|0|2|0|0|0|null|5|||
99907|clone|false|true|205973|1|0|0|0|1|0|4|0.13|5|||
99907|serve|false|false|424305|6|0|0|0|7|0|8|0.40|2|Didn't get any search previews||
99907|recent|true|true|428219|2|5|1|0|0|0|0|null|5|The search bar deletes some of my text the first time I use it.||
12830|sort|true|false|367917|2|1|0|1|2|0|2|0.09|5|I got the exact documentation I needed, I just didn't add the '.shareCount' to my variables, otherwise I would've had the correct answer in 30 seconds.|Nope.|
14987|recent|true|false|484515|1|2|3|0|0|0|0|null|5|It was difficult searching for similar problems and couldn't get the most accurate result to complete this task||
17380|recent|true|false|541645|3|0|0|0|2|0|4|0.16|2|The search results window was too small.|No.|I searched outside the IDE in order to utilize a full-size browser window.
29016|clone|true|true|211228|2|5|1|1|2|2|2|0.05|4|I liked the integration into the development environment. The search did include answers for languages that were not relevant here.|maybe a timestamp to show how old the solution is. especially for languages where APIs change frequently, this would be helpful.|
32156|serve|true|false|571036|6|16|3|0|1|0|2|0.07|2|Only pulling up information from soo seems to be insufficient for certain tasks.|Suggest documentation pages based on problem spec?|
61514|recent|true|false|429998|4|6|1|0|0|0|0|null|2|I found it was difficult to find what I needed applying my own search query into Scout, but perhaps I was looking in the wrong places. I see now looking above at the solution where I went wrong as I was making changes to the wrong area. The links I looked at were also a bit misleading or I interpreted them poorly. Given an extra few minutes I may have come to this solution.|My own judgement should have been better to apply the previews.|
93100|serve|true|false|812669|9|12|2|0|11|0|31|0.60|3|||
69302|sort|true|true|308065|2|4|1|0|3|0|8|0.57|4|I still think the Scout interface is a bit too busy and I had to refine the original search but it gave me what I needed|adding the type of object type directly in the autogenerated search would have been better|NA